[
  {
    "id": "spk-001",
    "name": "Vikram Ashar",
    "title": "Chairman",
    "bio": "Vikram Ashar helps teams move from idea to delivery with practical playbooks, coaching, and measurable outcomes across enterprise programs.",
    "expertiseTags": [
      "ceo_vision",
      "strategy",
      "leadership"
    ],
    "photoAsset": "assets/images/speakers/spk-001.png"
  },
  {
    "id": "spk-002",
    "name": "Elena Novak",
    "title": "Chief Executive Officer (CEO)",
    "bio": "Elena Novak helps teams move from idea to delivery with practical playbooks, coaching, and measurable outcomes across enterprise programs.",
    "expertiseTags": [
      "ceo_vision",
      "strategy",
      "genai"
    ],
    "photoAsset": "assets/images/speakers/spk-002.png"
  },
  {
    "id": "spk-003",
    "name": "Dr. Arjun Mehta",
    "title": "Chief Technology Officer (CTO)",
    "bio": "Dr. Arjun Mehta helps teams move from idea to delivery with practical playbooks, coaching, and measurable outcomes across enterprise programs.",
    "expertiseTags": [
      "architecture",
      "genai",
      "emerging_tech"
    ],
    "photoAsset": "assets/images/speakers/spk-003.png"
  },
  {
    "id": "spk-004",
    "name": "Sarah Lindstrom",
    "title": "Chief Operating Officer (COO)",
    "bio": "Sarah Lindstrom helps teams move from idea to delivery with practical playbooks, coaching, and measurable outcomes across enterprise programs.",
    "expertiseTags": [
      "strategy",
      "client_delivery"
    ],
    "photoAsset": "assets/images/speakers/spk-004.png"
  },
  {
    "id": "spk-005",
    "name": "Anil Kapoor",
    "title": "Chief Financial Officer (CFO)",
    "bio": "Anil Kapoor helps teams move from idea to delivery with practical playbooks, coaching, and measurable outcomes across enterprise programs.",
    "expertiseTags": [
      "strategy",
      "financial_services"
    ],
    "photoAsset": "assets/images/speakers/spk-005.png"
  },
  {
    "id": "spk-006",
    "name": "Priya Sharma",
    "title": "Chief People Officer (CPO)",
    "bio": "Priya Sharma helps teams move from idea to delivery with practical playbooks, coaching, and measurable outcomes across enterprise programs.",
    "expertiseTags": [
      "culture",
      "leadership"
    ],
    "photoAsset": "assets/images/speakers/spk-006.png"
  },
  {
    "id": "spk-007",
    "name": "Marcus Chen",
    "title": "Chief Delivery Officer (CDO)",
    "bio": "Marcus Chen helps teams move from idea to delivery with practical playbooks, coaching, and measurable outcomes across enterprise programs.",
    "expertiseTags": [
      "client_delivery",
      "strategy"
    ],
    "photoAsset": "assets/images/speakers/spk-007.png"
  },
  {
    "id": "spk-008",
    "name": "Dr. Fiona Okafor",
    "title": "Global Head of AI Practice",
    "bio": "Dr. Fiona Okafor helps teams move from idea to delivery with practical playbooks, coaching, and measurable outcomes across enterprise programs.",
    "expertiseTags": [
      "genai",
      "responsible_ai",
      "llm_agents"
    ],
    "photoAsset": "assets/images/speakers/spk-008.png"
  },
  {
    "id": "spk-009",
    "name": "Rajesh Iyer",
    "title": "Chief Architect",
    "bio": "Rajesh Iyer helps teams move from idea to delivery with practical playbooks, coaching, and measurable outcomes across enterprise programs.",
    "expertiseTags": [
      "architecture",
      "cloud",
      "platform_engineering"
    ],
    "photoAsset": "assets/images/speakers/spk-009.png"
  },
  {
    "id": "spk-010",
    "name": "James Whitfield",
    "title": "VP, Cloud Engineering",
    "bio": "James Whitfield helps teams move from idea to delivery with practical playbooks, coaching, and measurable outcomes across enterprise programs.",
    "expertiseTags": [
      "cloud",
      "kubernetes",
      "platform_engineering"
    ],
    "photoAsset": "assets/images/speakers/spk-010.png"
  },
  {
    "id": "spk-011",
    "name": "Ananya Desai",
    "title": "Unit Head — Financial Services",
    "bio": "Ananya Desai helps teams move from idea to delivery with practical playbooks, coaching, and measurable outcomes across enterprise programs.",
    "expertiseTags": [
      "financial_services",
      "client_delivery"
    ],
    "photoAsset": "assets/images/speakers/spk-011.png"
  },
  {
    "id": "spk-012",
    "name": "Michael Torres",
    "title": "Unit Head — Healthcare & Life Sciences",
    "bio": "Michael Torres helps teams move from idea to delivery with practical playbooks, coaching, and measurable outcomes across enterprise programs.",
    "expertiseTags": [
      "healthcare",
      "client_delivery"
    ],
    "photoAsset": "assets/images/speakers/spk-012.png"
  },
  {
    "id": "spk-013",
    "name": "Lisa Bergmann",
    "title": "Practice Head — Data & Analytics",
    "bio": "Lisa Bergmann helps teams move from idea to delivery with practical playbooks, coaching, and measurable outcomes across enterprise programs.",
    "expertiseTags": [
      "mlops",
      "data_mesh"
    ],
    "photoAsset": "assets/images/speakers/spk-013.png"
  },
  {
    "id": "spk-014",
    "name": "Kenji Yamamoto",
    "title": "Distinguished Engineer",
    "bio": "Kenji Yamamoto helps teams move from idea to delivery with practical playbooks, coaching, and measurable outcomes across enterprise programs.",
    "expertiseTags": [
      "architecture",
      "devex",
      "emerging_tech"
    ],
    "photoAsset": "assets/images/speakers/spk-014.png"
  },
  {
    "id": "spk-015",
    "name": "Sofia Petrov",
    "title": "Principal Architect — Integration",
    "bio": "Sofia Petrov helps teams move from idea to delivery with practical playbooks, coaching, and measurable outcomes across enterprise programs.",
    "expertiseTags": [
      "architecture",
      "apis",
      "cloud"
    ],
    "photoAsset": "assets/images/speakers/spk-015.png"
  },
  {
    "id": "spk-016",
    "name": "David Okonkwo",
    "title": "Head of Cybersecurity",
    "bio": "David Okonkwo helps teams move from idea to delivery with practical playbooks, coaching, and measurable outcomes across enterprise programs.",
    "expertiseTags": [
      "cybersecurity",
      "responsible_ai"
    ],
    "photoAsset": "assets/images/speakers/spk-016.png"
  },
  {
    "id": "spk-017",
    "name": "Mei Lin",
    "title": "Head of Sustainability Practice",
    "bio": "Mei Lin helps teams move from idea to delivery with practical playbooks, coaching, and measurable outcomes across enterprise programs.",
    "expertiseTags": [
      "sustainability",
      "innovation"
    ],
    "photoAsset": "assets/images/speakers/spk-017.png"
  },
  {
    "id": "spk-018",
    "name": "Thomas Berger",
    "title": "VP, Client Partner — Automotive",
    "bio": "Thomas Berger helps teams move from idea to delivery with practical playbooks, coaching, and measurable outcomes across enterprise programs.",
    "expertiseTags": [
      "automotive",
      "client_delivery"
    ],
    "photoAsset": "assets/images/speakers/spk-018.png"
  },
  {
    "id": "spk-019",
    "name": "Rachel Kim",
    "title": "Senior Director, DevEx",
    "bio": "Rachel Kim helps teams move from idea to delivery with practical playbooks, coaching, and measurable outcomes across enterprise programs.",
    "expertiseTags": [
      "devex",
      "cursor",
      "apis"
    ],
    "photoAsset": "assets/images/speakers/spk-019.png"
  },
  {
    "id": "spk-020",
    "name": "Omar Hassan",
    "title": "Lead Consultant, GenAI",
    "bio": "Omar Hassan helps teams move from idea to delivery with practical playbooks, coaching, and measurable outcomes across enterprise programs.",
    "expertiseTags": [
      "genai",
      "llm_agents",
      "client_delivery"
    ],
    "photoAsset": "assets/images/speakers/spk-020.png"
  },
  {
    "id": "spk-021",
    "name": "Aarav Sharma",
    "title": "Solution Architect",
    "bio": "Aarav Sharma runs hands-on sessions focused on reusable playbooks, peer learning, and concrete delivery outcomes teams can apply the next Monday.",
    "expertiseTags": [
      "innovation",
      "hackathon"
    ]
  },
  {
    "id": "spk-022",
    "name": "Ira Bose",
    "title": "Practice Lead",
    "bio": "Ira Bose runs hands-on sessions focused on reusable playbooks, peer learning, and concrete delivery outcomes teams can apply the next Monday.",
    "expertiseTags": [
      "cybersecurity",
      "compliance"
    ]
  },
  {
    "id": "spk-023",
    "name": "Nisha Mehta",
    "title": "Senior Consultant",
    "bio": "Nisha Mehta runs hands-on sessions focused on reusable playbooks, peer learning, and concrete delivery outcomes teams can apply the next Monday.",
    "expertiseTags": [
      "innovation",
      "hackathon"
    ]
  },
  {
    "id": "spk-024",
    "name": "Rohan Rao",
    "title": "Principal Engineer",
    "bio": "Rohan Rao runs hands-on sessions focused on reusable playbooks, peer learning, and concrete delivery outcomes teams can apply the next Monday.",
    "expertiseTags": [
      "genai",
      "innovation"
    ]
  },
  {
    "id": "spk-025",
    "name": "Kavya Mehta",
    "title": "Lead Data Scientist",
    "bio": "Kavya Mehta runs hands-on sessions focused on reusable playbooks, peer learning, and concrete delivery outcomes teams can apply the next Monday.",
    "expertiseTags": [
      "mlops",
      "responsible_ai"
    ]
  },
  {
    "id": "spk-026",
    "name": "Meera Singh",
    "title": "Engineering Manager",
    "bio": "Meera Singh runs hands-on sessions focused on reusable playbooks, peer learning, and concrete delivery outcomes teams can apply the next Monday.",
    "expertiseTags": [
      "cybersecurity",
      "compliance"
    ]
  },
  {
    "id": "spk-027",
    "name": "Aniket Desai",
    "title": "Solution Architect",
    "bio": "Aniket Desai runs hands-on sessions focused on reusable playbooks, peer learning, and concrete delivery outcomes teams can apply the next Monday.",
    "expertiseTags": [